Sheet: About
A1: About this workbook | C1: Columns | D1: How the data was determined
C2: Number | D2: The number of TED XML files that contain the indicated data.
A3: The data in this workbook was derived from analysis of 610.646 TED XML files. | C3: Percentage | D3: The percentage of the Number column divided by the total number of files (601.646)
A4: These files were "TED Export" files downloaded from TED Monitor Archive 2020 and 2021 from these URLs: | C4: Form element | D4: The name of the element at XPath /TED_EXPORT/FORM_SECTION/*, excluding NOTICE_UUID Where multiple such elements existed in one XML file, they all had the same name
A5: https://intragate.ec.europa.eu/appviewer/tedmonitor/int/data/repo/20/ | C5: Form number | D5: The value of the "FORM" attribute in the Form element Where multiple Form elements existed in one XML file, they all had the same value for the "FORM" attribute
A6: https://intragate.ec.europa.eu/appviewer/tedmonitor/int/data/repo/21/ | C6: Number of languages | D6: The number of different values of the "LG" attribute for the Form elements Where multiple Form elements existed in one XML file, they all had different values for the "LG" attribute
C7: Schema | D7: The value of the "VERSION" attribute of the "TED_EXPORT" element, or the value of the "VERSION" attribute of the Form element
A8: The data was collated and analysed using Unix Bash, Perl and XQuery. | C8: Legal basis | D8: Where Form element was "MOVE" or started with "F", either the value of the "VALUE" attribute of the "LEGAL_BASIS" element, or "OTHER" where the element "LEGAL_BASIS_OTHER" existed. Where the "Schema" started with "R2.0.8", the value "32009L0081" Blank for all other cases
C9: Notice Type | D9: The value of the "TYPE" attribute of the "NOTICE" element
A10: The sheet "form-notice-legal-document", is designed to be used for a mapping of TED data and eForms Notice subtypes. That is, it should be possible using the information in this sheet to determine for any TED XML notice file, which eForms subtype it should be converted to. It is in draft form, and more information is required, and then checked. | C10: Document code | D10: The value of the "CODE" attribute of the "TD_DOCUMENT_TYPE" element
C11: Document type | D11: The value of the content of the "TD_DOCUMENT_TYPE" element
C12: enotices-form-name | D12: The name of the form matching the Form number, taken from the eNotices "Start new form" page
C13: deloitte-mapping | D13: The eForms subtype number(s) matching the Form number, taken from the Deloitte "TED XML Mapping" spreadsheets
C14: eForms subtype | D14: Proposed mapping to eForms subtypes. This must be completed and validated.
C15: Notice description | D15: The notice description for the eForms subtype, taken from the eForms Regulation
A31: Sheets
A32: form-element
A34: form-legal-basis
A35: legal-basis
A36: schemas
A37: form-language-count
A38: form-notice-legal-document

Sheet: form-element
A1: Form element | B1: Form number | C1: Number | D1: Percentage
A2: F01_2014 | B2: F01 | C2: 11539 | D2: =RC[-1]/610646*100 -> 1.8896381864451743
A3: F02_2014 | B3: F02 | C3: 197346 | D3: =RC[-1]/610646*100 -> 32.317578433331256
A4: F03_2014 | B4: F03 | C4: 225517 | D4: =RC[-1]/610646*100 -> 36.930889582507703
A5: F04_2014 | B5: F04 | C5: 848 | D5: =RC[-1]/610646*100 -> 0.13886932854714515
A6: F05_2014 | B6: F05 | C6: 20084 | D6: =RC[-1]/610646*100 -> 3.2889759369585652
A7: F06_2014 | B7: F06 | C7: 25342 | D7: =RC[-1]/610646*100 -> 4.1500312783511228
A8: F07_2014 | B8: F07 | C8: 736 | D8: =RC[-1]/610646*100 -> 0.12052809647488071
A9: F08_2014 | B9: F08 | C9: 1540 | D9: =RC[-1]/610646*100 -> 0.25219194099363623
A10: F12_2014 | B10: F12 | C10: 1116 | D10: =RC[-1]/610646*100 -> 0.18275727672006367
A11: F13_2014 | B11: F13 | C11: 812 | D11: =RC[-1]/610646*100 -> 0.13297393252391729
A12: F14_2014 | B12: F14 | C12: 74628 | D12: =RC[-1]/610646*100 -> 12.221155956151355
A13: F15_2014 | B13: F15 | C13: 7710 | D13: =RC[-1]/610646*100 -> 1.2625973149746335
A14: F20_2014 | B14: F20 | C14: 25756 | D14: =RC[-1]/610646*100 -> 4.217828332618244
A15: F21_2014 | B15: F21 | C15: 9687 | D15: =RC[-1]/610646*100 -> 1.5863528132502303
A16: F22_2014 | B16: F22 | C16: 224 | D16: =RC[-1]/610646*100 -> 3.6682464144528908E-2
A17: F23_2014 | B17: F23 | C17: 137 | D17: =RC[-1]/610646*100 -> 2.2435257088394913E-2
A18: F24_2014 | B18: F24 | C18: 1228 | D18: =RC[-1]/610646*100 -> 0.20109850879232813
A19: F25_2014 | B19: F25 | C19: 835 | D19: =RC[-1]/610646*100 -> 0.13674043553875731
A20: PRIOR_INFORMATION_DEFENCE | B20: 16 | C20: 94 | D20: =RC[-1]/610646*100 -> 1.5393534060650525E-2
A21: CONTRACT_DEFENCE | B21: 17 | C21: 1552 | D21: =RC[-1]/610646*100 -> 0.25415707300137885
A22: CONTRACT_AWARD_DEFENCE | B22: 18 | C22: 1913 | D22: =RC[-1]/610646*100 -> 0.31327479423430271
A23: CONTRACT_CONCESSIONAIRE_DEFENCE | B23: 19 | C23: 1 | D23: =RC[-1]/610646*100 -> 1.6376100064521834E-4
A24: MOVE | B24: T01 | C24: 582 | D24: =RC[-1]/610646*100 -> 9.5308902375517077E-2
A25: MOVE | B25: T02 | C25: 37 | D25: =RC[-1]/610646*100 -> 6.0591570238730788E-3
A26: EEIG | C26: 33 | D26: =RC[-1]/610646*100 -> 5.4041130212922053E-3
A27: OTH_NOT | C27: 1349 | D27: =RC[-1]/610646*100 -> 0.22091358987039955
C28: =SUM(R[-26]C:R[-1]C) -> 610646

Sheet: form-legal-basis
A1: Form element | B1: Form number | C1: Legal basis | D1: Number | E1: Percentage
A2: F01_2014 | B2: F01 | C2: 32014L0024 | D2: 11371 | E2: =RC[-1]/610646*100 -> 1.8621263383367777
A3: F01_2014 | B3: F01 | C3: 32018R1046 | D3: 157 | E3: =RC[-1]/610646*100 -> 2.5710477101299277E-2
A4: F01_2014 | B4: F01 | C4: OTHER | D4: 11 | E4: =RC[-1]/610646*100 -> 1.8013710070974016E-3
A5: F02_2014 | B5: F02 | C5: 32014L0024 | D5: 196328 | E5: =RC[-1]/610646*100 -> 32.150869734674423
A6: F02_2014 | B6: F02 | C6: 32018R1046 | D6: 918 | E6: =RC[-1]/610646*100 -> 0.15033259859231043
A7: F02_2014 | B7: F02 | C7: OTHER | D7: 100 | E7: =RC[-1]/610646*100 -> 1.6376100064521833E-2
A8: F03_2014 | B8: F03 | C8: 32014L0024 | D8: 224495 | E8: =RC[-1]/610646*100 -> 36.763525839848292
A9: F03_2014 | B9: F03 | C9: 32018R1046 | D9: 947 | E9: =RC[-1]/610646*100 -> 0.15508166761102177
A10: F03_2014 | B10: F03 | C10: OTHER | D10: 75 | E10: =RC[-1]/610646*100 -> 1.2282075048391374E-2
A11: F04_2014 | B11: F04 | C11: 32014L0025 | D11: 848 | E11: =RC[-1]/610646*100 -> 0.13886932854714515
A12: F05_2014 | B12: F05 | C12: 32014L0025 | D12: 20084 | E12: =RC[-1]/610646*100 -> 3.2889759369585652
A13: F06_2014 | B13: F06 | C13: 32014L0025 | D13: 25342 | E13: =RC[-1]/610646*100 -> 4.1500312783511228
A14: F07_2014 | B14: F07 | C14: 32014L0025 | D14: 736 | E14: =RC[-1]/610646*100 -> 0.12052809647488071
A15: F08_2014 | B15: F08 | C15: 32009L0081 | D15: 37 | E15: =RC[-1]/610646*100 -> 6.0591570238730788E-3
A16: F08_2014 | B16: F08 | C16: 32014L0024 | D16: 1316 | E16: =RC[-1]/610646*100 -> 0.21550947684910735
A17: F08_2014 | B17: F08 | C17: 32014L0025 | D17: 187 | E17: =RC[-1]/610646*100 -> 3.0623307120655828E-2
A18: F12_2014 | B18: F12 | C18: 32014L0024 | D18: 1083 | E18: =RC[-1]/610646*100 -> 0.17735316369877147
A19: F12_2014 | B19: F12 | C19: 32014L0025 | D19: 33 | E19: =RC[-1]/610646*100 -> 5.4041130212922053E-3
A20: F13_2014 | B20: F13 | C20: 32014L0024 | D20: 781 | E20: =RC[-1]/610646*100 -> 0.12789734150391552
A21: F13_2014 | B21: F13 | C21: 32014L0025 | D21: 31 | E21: =RC[-1]/610646*100 -> 5.0765910200017686E-3
A22: F14_2014 | B22: F14 | C22: 32004L0017 | D22: 6 | E22: =RC[-1]/610646*100 -> 9.8256600387130999E-4
A23: F14_2014 | B23: F14 | C23: 32004L0018 | D23: 10 | E23: =RC[-1]/610646*100 -> 1.6376100064521835E-3
A24: F14_2014 | B24: F14 | C24: 32007R1370 | D24: 151 | E24: =RC[-1]/610646*100 -> 2.4727911097427974E-2
A25: F14_2014 | B25: F14 | C25: 32009L0081 | D25: 207 | E25: =RC[-1]/610646*100 -> 3.3898527133560195E-2
A26: F14_2014 | B26: F14 | C26: 32014L0023 | D26: 516 | E26: =RC[-1]/610646*100 -> 8.4500676332932664E-2
A27: F14_2014 | B27: F14 | C27: 32014L0024 | D27: 63470 | E27: =RC[-1]/610646*100 -> 10.393910710952008
A28: F14_2014 | B28: F14 | C28: 32014L0025 | D28: 9826 | E28: =RC[-1]/610646*100 -> 1.6091155923399154
A29: F14_2014 | B29: F14 | C29: 32018R1046 | D29: 402 | E29: =RC[-1]/610646*100 -> 6.583192225937777E-2
A30: F14_2014 | B30: F14 | C30: OTHER | D30: 40 | E30: =RC[-1]/610646*100 -> 6.5504400258087339E-3
A31: F15_2014 | B31: F15 | C31: 32009L0081 | D31: 297 | E31: =RC[-1]/610646*100 -> 4.8637017191629849E-2
A32: F15_2014 | B32: F15 | C32: 32014L0023 | D32: 67 | E32: =RC[-1]/610646*100 -> 1.0971987043229629E-2
A33: F15_2014 | B33: F15 | C33: 32014L0024 | D33: 6873 | E33: =RC[-1]/610646*100 -> 1.1255293574345857
A34: F15_2014 | B34: F15 | C34: 32014L0025 | D34: 473 | E34: =RC[-1]/610646*100 -> 7.7458953305188274E-2
A35: F20_2014 | B35: F20 | C35: 32004L0017 | D35: 12 | E35: =RC[-1]/610646*100 -> 1.96513200774262E-3
A36: F20_2014 | B36: F20 | C36: 32004L0018 | D36: 56 | E36: =RC[-1]/610646*100 -> 9.1706160361322269E-3
A37: F20_2014 | B37: F20 | C37: 32007R1370 | D37: 13 | E37: =RC[-1]/610646*100 -> 2.1288930083878384E-3
A38: F20_2014 | B38: F20 | C38: 32009L0081 | D38: 8 | E38: =RC[-1]/610646*100 -> 1.3100880051617467E-3
A39: F20_2014 | B39: F20 | C39: 32014L0023 | D39: 252 | E39: =RC[-1]/610646*100 -> 4.1267772162595022E-2
A40: F20_2014 | B40: F20 | C40: 32014L0024 | D40: 15700 | E40: =RC[-1]/610646*100 -> 2.5710477101299278
A41: F20_2014 | B41: F20 | C41: 32014L0025 | D41: 9600 | E41: =RC[-1]/610646*100 -> 1.5721056061940959
A42: F20_2014 | B42: F20 | C42: 32018R1046 | D42: 91 | E42: =RC[-1]/610646*100 -> 1.4902251058714868E-2
A43: F20_2014 | B43: F20 | C43: OTHER | D43: 24 | E43: =RC[-1]/610646*100 -> 3.93026401548524E-3
A44: F21_2014 | B44: F21 | C44: 32014L0024 | D44: 9687 | E44: =RC[-1]/610646*100 -> 1.5863528132502303
A45: F22_2014 | B45: F22 | C45: 32014L0025 | D45: 224 | E45: =RC[-1]/610646*100 -> 3.6682464144528908E-2
A46: F23_2014 | B46: F23 | C46: 32014L0023 | D46: 137 | E46: =RC[-1]/610646*100 -> 2.2435257088394913E-2
A47: F24_2014 | B47: F24 | C47: 32014L0023 | D47: 1228 | E47: =RC[-1]/610646*100 -> 0.20109850879232813
A48: F25_2014 | B48: F25 | C48: 32014L0023 | D48: 835 | E48: =RC[-1]/610646*100 -> 0.13674043553875731
A49: CONTRACT_AWARD_DEFENCE | B49: 18 | C49: 32009L0081 | D49: 1913 | E49: =RC[-1]/610646*100 -> 0.31327479423430271
A50: CONTRACT_CONCESSIONAIRE_DEFENCE | B50: 19 | C50: 32009L0081 | D50: 1 | E50: =RC[-1]/610646*100 -> 1.6376100064521834E-4
A51: CONTRACT_DEFENCE | B51: 17 | C51: 32009L0081 | D51: 1552 | E51: =RC[-1]/610646*100 -> 0.25415707300137885
A52: PRIOR_INFORMATION_DEFENCE | B52: 16 | C52: 32009L0081 | D52: 94 | E52: =RC[-1]/610646*100 -> 1.5393534060650525E-2
A53: MOVE | B53: T01 | C53: 32007R1370 | D53: 582 | E53: =RC[-1]/610646*100 -> 9.5308902375517077E-2
A54: MOVE | B54: T02 | C54: 32007R1370 | D54: 37 | E54: =RC[-1]/610646*100 -> 6.0591570238730788E-3
A55: EEIG | D55: 33 | E55: =RC[-1]/610646*100 -> 5.4041130212922053E-3
A56: OTH_NOT | C56: 32009L0081 | D56: 1349 | E56: =RC[-1]/610646*100 -> 0.22091358987039955
D57: =SUM(R[-55]C:R[-1]C) -> 610646

Sheet: form-language-counts
A1: Number of languages | B1: Number of files | C1: Percentage of files
A2: Total | B2: =SUM(R[1]C:R[5]C) -> 610646
A3: 0 | B3: 1349 | C3: =RC[-1]/Total_language_files*100 -> 0.22091358987039955
A4: 1 | B4: 601551 | C4: =RC[-1]/Total_language_files*100 -> 98.510593699131746
A5: 2 | B5: 4914 | C5: =RC[-1]/Total_language_files*100 -> 0.80472155717060301
A6: 3 | B6: 80 | C6: =RC[-1]/Total_language_files*100 -> 1.3100880051617468E-2
A7: 24 | B7: 2752 | C7: =RC[-1]/Total_language_files*100 -> 0.45067027377564084

Sheet: schemas
A1: Schema | B1: Number | C1: Percentages
A2: R2.0.8.S04.E01 | B2: 4806 | C2: =RC[-1]/schemas_total*100 -> 0.78703536910091942
A3: R2.0.8.S05.E01 | B3: 136 | C3: =RC[-1]/schemas_total*100 -> 2.2271496087749695E-2
A4: R2.0.9.S03.E01 | B4: 587968 | C4: =RC[-1]/schemas_total*100 -> 96.286228027367741
A5: R2.0.9.S04.E01 | B5: 17736 | C5: =RC[-1]/schemas_total*100 -> 2.9044651074435923
B6: =SUM(R[-4]C:R[-1]C) -> 610646

Sheet: legal-basis
A1: Legal Basis | B1: Notice Count | C1: Percentage
B2: 33 | C2: =RC[-1]/legal_basis_total*100 -> 5.4041130212922053E-3
A3: 32004L0017 | B3: 18 | C3: =RC[-1]/legal_basis_total*100 -> 2.9476980116139302E-3
A4: 32004L0018 | B4: 66 | C4: =RC[-1]/legal_basis_total*100 -> 1.0808226042584411E-2
A5: 32007R1370 | B5: 783 | C5: =RC[-1]/legal_basis_total*100 -> 0.12822486350520598
A6: 32009L0081 | B6: 5458 | C6: =RC[-1]/legal_basis_total*100 -> 0.89380754152160158
A7: 32014L0023 | B7: 3035 | C7: =RC[-1]/legal_basis_total*100 -> 0.49701463695823767
A8: 32014L0024 | B8: 531104 | C8: =RC[-1]/legal_basis_total*100 -> 86.974122486678041
A9: 32014L0025 | B9: 67384 | C9: =RC[-1]/legal_basis_total*100 -> 11.034871267477394
A10: 32018R1046 | B10: 2515 | C10: =RC[-1]/legal_basis_total*100 -> 0.41185891662272411
A11: LEGAL_BASIS_OTHER | B11: 250 | C11: =RC[-1]/legal_basis_total*100 -> 4.0940250161304585E-2
B12: =SUM(R[-10]C:R[-1]C) -> 610646

Sheet: form-notice-mapping
A1: Form element | B1: Form number | C1: Notice type | D1: Legal basis | E1: Document code | F1: Document type | G1: Number | H1: Percentage | I1: enotices-form-name | J1: deloitte-mapping | K1: eForms subtype | L1: Notice description
A2: F01_2014 | B2: F01 | C2: PRI_CALL_COMPETITION | D2: 32014L0024 | E2: A | F2: Prior information notice with call for competition | G2: 409 | H2: =RC[-1]/fnld_total*100 -> 6.6978249263894299E-2 | I2: Prior information notice | J2: 4,7,10 | K2: 10 | L2: Prior information notice used as a call for competition - general directive, standard regime
A3: F01_2014 | B3: F01 | C3: PRI_CALL_COMPETITION | D3: 32018R1046 | E3: A | F3: Prior information notice with call for competition | G3: 1 | H3: =RC[-1]/fnld_total*100 -> 1.6376100064521834E-4 | I3: Prior information notice | J3: 4,7,10
A4: F01_2014 | B4: F01 | C4: PRI_CALL_COMPETITION | D4: OTHER | E4: A | F4: Prior information notice with call for competition | G4: 5 | H4: =RC[-1]/fnld_total*100 -> 8.1880500322609173E-4 | I4: Prior information notice | J4: 4,7,10
A5: F01_2014 | B5: F01 | C5: PRI_ONLY | D5: 32014L0024 | E5: 0 | F5: Prior information notice without call for competition | G5: 7390 | H5: =RC[-1]/fnld_total*100 -> 1.2101937947681636 | I5: Prior information notice | J5: 4,7,10 | K5: 4 | L5: Prior information notice used only for information – general directive
A6: F01_2014 | B6: F01 | C6: PRI_ONLY | D6: 32018R1046 | E6: 0 | F6: Prior information notice without call for competition | G6: 156 | H6: =RC[-1]/fnld_total*100 -> 2.5546716100654062E-2 | I6: Prior information notice | J6: 4,7,10
A7: F01_2014 | B7: F01 | C7: PRI_ONLY | D7: OTHER | E7: 0 | F7: Prior information notice without call for competition | G7: 6 | H7: =RC[-1]/fnld_total*100 -> 9.8256600387130999E-4 | I7: Prior information notice | J7: 4,7,10
A8: F01_2014 | B8: F01 | C8: PRI_REDUCING_TIME_LIMITS | D8: 32014L0024 | E8: 0 | F8: Prior information notice without call for competition | G8: 3572 | H8: =RC[-1]/fnld_total*100 -> 0.5849542943047199 | I8: Prior information notice | J8: 4,7,10 | K8: 7 | L8: Prior information notice used to shorten time limits for receipt of tenders – general directive
A9: F02_2014 | B9: F02 | D9: 32014L0024 | E9: 3 | F9: Contract notice | G9: 195384 | H9: =RC[-1]/fnld_total*100 -> 31.996279350065343 | I9: Contract notice | J9: 16 | K9: 16 | L9: Contract notice – general directive, standard regime
A10: F02_2014 | B10: F02 | D10: 32014L0024 | E10: Y | F10: Dynamic purchasing system | G10: 944 | H10: =RC[-1]/fnld_total*100 -> 0.15459038460908611 | I10: Contract notice | J10: 16 | K10: 16 | L10: Contract notice – general directive, standard regime
A11: F02_2014 | B11: F02 | D11: 32018R1046 | E11: 3 | F11: Contract notice | G11: 917 | H11: =RC[-1]/fnld_total*100 -> 0.15016883759166522 | I11: Contract notice | J11: 16 | K11: 16 | L11: Contract notice – general directive, standard regime
A12: F02_2014 | B12: F02 | D12: 32018R1046 | E12: Y | F12: Dynamic purchasing system | G12: 1 | H12: =RC[-1]/fnld_total*100 -> 1.6376100064521834E-4 | I12: Contract notice | J12: 16 | K12: 16 | L12: Contract notice – general directive, standard regime
A13: F02_2014 | B13: F02 | D13: OTHER | E13: 3 | F13: Contract notice | G13: 100 | H13: =RC[-1]/fnld_total*100 -> 1.6376100064521833E-2 | I13: Contract notice | J13: 16
A14: F03_2014 | B14: F03 | D14: 32014L0024 | E14: 7 | F14: Contract award notice | G14: 224495 | H14: =RC[-1]/fnld_total*100 -> 36.763525839848292 | I14: Contract award notice | J14: 29 | K14: 29 | L14: Contract award notice – general directive, standard regime
A15: F03_2014 | B15: F03 | D15: 32018R1046 | E15: 7 | F15: Contract award notice | G15: 947 | H15: =RC[-1]/fnld_total*100 -> 0.15508166761102177 | I15: Contract award notice | J15: 29 | K15: 29 | L15: Contract award notice – general directive, standard regime
A16: F03_2014 | B16: F03 | D16: OTHER | E16: 7 | F16: Contract award notice | G16: 75 | H16: =RC[-1]/fnld_total*100 -> 1.2282075048391374E-2 | I16: Contract award notice | J16: 29
A17: F04_2014 | B17: F04 | C17: PER_CALL_COMPETITION | D17: 32014L0025 | E17: M | F17: Periodic indicative notice with call for competition | G17: 107 | H17: =RC[-1]/fnld_total*100 -> 1.7522427069038362E-2 | I17: Periodic indicative notice – utilities | J17: 5,8,11 | K17: 11 | L17: Periodic indicative notice used as a call for competition - sectoral directive, standard regime
A18: F04_2014 | B18: F04 | C18: PER_ONLY | D18: 32014L0025 | E18: P | F18: Periodic indicative notice without call for competition | G18: 489 | H18: =RC[-1]/fnld_total*100 -> 8.0079129315511768E-2 | I18: Periodic indicative notice – utilities | J18: 5,8,11 | K18: 5 | L18: Periodic indicative notice used only for information – sectoral directive
A19: F04_2014 | B19: F04 | C19: PER_REDUCING_TIME_LIMITS | D19: 32014L0025 | E19: P | F19: Periodic indicative notice without call for competition | G19: 252 | H19: =RC[-1]/fnld_total*100 -> 4.1267772162595022E-2 | I19: Periodic indicative notice – utilities | J19: 5,8,11 | K19: 8 | L19: Periodic indicative notice used to shorten time limits for receipt of tenders – sectoral directive
A20: F05_2014 | B20: F05 | D20: 32014L0025 | E20: 3 | F20: Contract notice | G20: 19999 | H20: =RC[-1]/fnld_total*100 -> 3.2750562519037212 | I20: Contract notice – utilities | J20: 17 | K20: 17 | L20: Contract notice – sectoral directive, standard regime
A21: F05_2014 | B21: F05 | D21: 32014L0025 | E21: Y | F21: Dynamic purchasing system | G21: 85 | H21: =RC[-1]/fnld_total*100 -> 1.391968505484356E-2 | I21: Contract notice – utilities | J21: 17 | K21: 17 | L21: Contract notice – sectoral directive, standard regime
A22: F06_2014 | B22: F06 | D22: 32014L0025 | E22: 7 | F22: Contract award notice | G22: 25342 | H22: =RC[-1]/fnld_total*100 -> 4.1500312783511228 | I22: Contract award notice – utilities | J22: 30 | K22: 30 | L22: Contract award notice – sectoral directive, standard regime
A23: F07_2014 | B23: F07 | D23: 32014L0025 | E23: Q | F23: Qualification system without call for competition | G23: 220 | H23: =RC[-1]/fnld_total*100 -> 3.6027420141948041E-2 | I23: Qualification system – utilities | J23: 15 | K23: 15 | L23: Notice on the existence of a qualification system – sectoral directive
A24: F07_2014 | B24: F07 | C24: QSU_CALL_COMPETITION | D24: 32014L0025 | E24: O | F24: Qualification system with call for competition | G24: 516 | H24: =RC[-1]/fnld_total*100 -> 8.4500676332932664E-2 | I24: Qualification system – utilities | J24: 15 | K24: 15 | L24: Notice on the existence of a qualification system – sectoral directive
A25: F08_2014 | B25: F08 | D25: 32009L0081 | E25: B | F25: Buyer profile | G25: 37 | H25: =RC[-1]/fnld_total*100 -> 6.0591570238730788E-3 | I25: Notice on a buyer profile | J25: 1,2,3 | K25: 3 | L25: Notice of the publication of a prior information notice on a buyer profile - defence directive
A26: F08_2014 | B26: F08 | D26: 32014L0024 | E26: B | F26: Buyer profile | G26: 1316 | H26: =RC[-1]/fnld_total*100 -> 0.21550947684910735 | I26: Notice on a buyer profile | J26: 1,2,3 | K26: 1 | L26: Notice of the publication of a prior information notice on a buyer profile - general directive
A27: F08_2014 | B27: F08 | D27: 32014L0025 | E27: B | F27: Buyer profile | G27: 187 | H27: =RC[-1]/fnld_total*100 -> 3.0623307120655828E-2 | I27: Notice on a buyer profile | J27: 1,2,3 | K27: 2 | L27: Notice of the publication of a periodic indicative notice on a buyer profile - sectoral directive
A28: F12_2014 | B28: F12 | D28: 32014L0024 | E28: D | F28: Design contest | G28: 1083 | H28: =RC[-1]/fnld_total*100 -> 0.17735316369877147 | I28: Design contest notice | J28: 23,24 | K28: 23 | L28: Design contest notice – general directive, design
A29: F12_2014 | B29: F12 | D29: 32014L0025 | E29: D | F29: Design contest | G29: 33 | H29: =RC[-1]/fnld_total*100 -> 5.4041130212922053E-3 | I29: Design contest notice | J29: 23,24 | K29: 24 | L29: Design contest notice – sectoral directive, design
A30: F13_2014 | B30: F13 | D30: 32014L0024 | E30: R | F30: Results of design contests | G30: 781 | H30: =RC[-1]/fnld_total*100 -> 0.12789734150391552 | I30: Results of design contest | J30: 36,37 | K30: 36 | L30: Design contest result notice – general directive, design
A31: F13_2014 | B31: F13 | D31: 32014L0025 | E31: R | F31: Results of design contests | G31: 31 | H31: =RC[-1]/fnld_total*100 -> 5.0765910200017686E-3 | I31: Results of design contest | J31: 36,37 | K31: 37 | L31: Design contest result notice – sectoral directive, design
A32: F14_2014 | B32: F14 | D32: 32004L0017 | E32: 2 | F32: Additional information | G32: 6 | H32: =RC[-1]/fnld_total*100 -> 9.8256600387130999E-4
A33: F14_2014 | B33: F14 | D33: 32004L0018 | E33: 2 | F33: Additional information | G33: 10 | H33: =RC[-1]/fnld_total*100 -> 1.6376100064521835E-3
A34: F14_2014 | B34: F14 | D34: 32007R1370 | E34: 1 | F34: Corrigendum | G34: 1 | H34: =RC[-1]/fnld_total*100 -> 1.6376100064521834E-4
A35: F14_2014 | B35: F14 | D35: 32007R1370 | E35: 2 | F35: Additional information | G35: 150 | H35: =RC[-1]/fnld_total*100 -> 2.4564150096782748E-2
A36: F14_2014 | B36: F14 | D36: 32009L0081 | E36: 1 | F36: Corrigendum | G36: 2 | H36: =RC[-1]/fnld_total*100 -> 3.2752200129043668E-4
A37: F14_2014 | B37: F14 | D37: 32009L0081 | E37: 2 | F37: Additional information | G37: 205 | H37: =RC[-1]/fnld_total*100 -> 3.3571005132269759E-2
A38: F14_2014 | B38: F14 | D38: 32014L0023 | E38: 2 | F38: Additional information | G38: 516 | H38: =RC[-1]/fnld_total*100 -> 8.4500676332932664E-2
A39: F14_2014 | B39: F14 | D39: 32014L0024 | E39: 1 | F39: Corrigendum | G39: 35 | H39: =RC[-1]/fnld_total*100 -> 5.731635022582642E-3
A40: F14_2014 | B40: F14 | D40: 32014L0024 | E40: 2 | F40: Additional information | G40: 63435 | H40: =RC[-1]/fnld_total*100 -> 10.388179075929425
A41: F14_2014 | B41: F14 | D41: 32014L0025 | E41: 1 | F41: Corrigendum | G41: 9 | H41: =RC[-1]/fnld_total*100 -> 1.4738490058069651E-3
A42: F14_2014 | B42: F14 | D42: 32014L0025 | E42: 2 | F42: Additional information | G42: 9817 | H42: =RC[-1]/fnld_total*100 -> 1.6076417433341084
A43: F14_2014 | B43: F14 | D43: 32018R1046 | E43: 2 | F43: Additional information | G43: 402 | H43: =RC[-1]/fnld_total*100 -> 6.583192225937777E-2
A44: F14_2014 | B44: F14 | D44: OTHER | E44: 2 | F44: Additional information | G44: 40 | H44: =RC[-1]/fnld_total*100 -> 6.5504400258087339E-3
A45: F15_2014 | B45: F15 | D45: 32009L0081 | E45: V | F45: Voluntary ex ante transparency notice | G45: 297 | H45: =RC[-1]/fnld_total*100 -> 4.8637017191629849E-2 | I45: Voluntary ex ante transparency notice | J45: 25,26,27,28 | K45: 27 | L45: Voluntary ex-ante transparency notice – defence directive
A46: F15_2014 | B46: F15 | D46: 32014L0023 | E46: V | F46: Voluntary ex ante transparency notice | G46: 67 | H46: =RC[-1]/fnld_total*100 -> 1.0971987043229629E-2 | I46: Voluntary ex ante transparency notice | J46: 25,26,27,28 | K46: 28 | L46: Voluntary ex-ante transparency notice – concession directive
A47: F15_2014 | B47: F15 | D47: 32014L0024 | E47: V | F47: Voluntary ex ante transparency notice | G47: 6873 | H47: =RC[-1]/fnld_total*100 -> 1.1255293574345857 | I47: Voluntary ex ante transparency notice | J47: 25,26,27,28 | K47: 25 | L47: Voluntary ex-ante transparency notice – general directive
A48: F15_2014 | B48: F15 | D48: 32014L0025 | E48: V | F48: Voluntary ex ante transparency notice | G48: 473 | H48: =RC[-1]/fnld_total*100 -> 7.7458953305188274E-2 | I48: Voluntary ex ante transparency notice | J48: 25,26,27,28 | K48: 26 | L48: Voluntary ex-ante transparency notice – sectoral directive
A49: PRIOR_INFORMATION_DEFENCE | B49: 16 | D49: 32009L0081 | E49: 0 | F49: Prior information notice without call for competition | G49: 94 | H49: =RC[-1]/fnld_total*100 -> 1.5393534060650525E-2 | I49: Prior information notice for contracts in the field of defence and security | J49: 6 | K49: 6 | L49: Prior information notice used only for information – defence directive
A50: CONTRACT_DEFENCE | B50: 17 | D50: 32009L0081 | E50: 3 | F50: Contract notice | G50: 1552 | H50: =RC[-1]/fnld_total*100 -> 0.25415707300137885 | I50: Contract notice for contracts in the field of defence and security | J50: 18 | K50: 18 | L50: Contract notice – defence directive, standard regime
A51: CONTRACT_AWARD_DEFENCE | B51: 18 | D51: 32009L0081 | E51: 7 | F51: Contract award notice | G51: 1913 | H51: =RC[-1]/fnld_total*100 -> 0.31327479423430271 | I51: Contract award notice for contracts in the field of defence and security | J51: 31 | K51: 31 | L51: Contract award notice – defence directive, standard regime
A52: CONTRACT_CONCESSIONAIRE_DEFENCE | B52: 19 | D52: 32009L0081 | E52: F | F52: Subcontract notice (in the fields of defence and security) | G52: 1 | H52: =RC[-1]/fnld_total*100 -> 1.6376100064521834E-4 | I52: Subcontract notice | J52: 22 | K52: 22 | L52: Subcontract notice – defence directive
A53: F20_2014 | B53: F20 | D53: 32004L0017 | E53: K | F53: Modification of a contract/concession during its term | G53: 12 | H53: =RC[-1]/fnld_total*100 -> 1.96513200774262E-3 | I53: Modification notice | J53: 38,39,40
A54: F20_2014 | B54: F20 | D54: 32004L0018 | E54: K | F54: Modification of a contract/concession during its term | G54: 56 | H54: =RC[-1]/fnld_total*100 -> 9.1706160361322269E-3 | I54: Modification notice | J54: 38,39,40
A55: F20_2014 | B55: F20 | D55: 32007R1370 | E55: K | F55: Modification of a contract/concession during its term | G55: 13 | H55: =RC[-1]/fnld_total*100 -> 2.1288930083878384E-3 | I55: Modification notice | J55: 38,39,40
A56: F20_2014 | B56: F20 | D56: 32009L0081 | E56: K | F56: Modification of a contract/concession during its term | G56: 8 | H56: =RC[-1]/fnld_total*100 -> 1.3100880051617467E-3 | I56: Modification notice | J56: 38,39,40
A57: F20_2014 | B57: F20 | D57: 32014L0023 | E57: K | F57: Modification of a contract/concession during its term | G57: 252 | H57: =RC[-1]/fnld_total*100 -> 4.1267772162595022E-2 | I57: Modification notice | J57: 38,39,40 | K57: 40 | L57: Contract modification notice – concessions directive
A58: F20_2014 | B58: F20 | D58: 32014L0024 | E58: K | F58: Modification of a contract/concession during its term | G58: 15700 | H58: =RC[-1]/fnld_total*100 -> 2.5710477101299278 | I58: Modification notice | J58: 38,39,40 | K58: 38 | L58: Contract modification notice – general directive
A59: F20_2014 | B59: F20 | D59: 32014L0025 | E59: K | F59: Modification of a contract/concession during its term | G59: 9600 | H59: =RC[-1]/fnld_total*100 -> 1.5721056061940959 | I59: Modification notice | J59: 38,39,40 | K59: 39 | L59: Contract modification notice – sectoral directive
A60: F20_2014 | B60: F20 | D60: 32018R1046 | E60: K | F60: Modification of a contract/concession during its term | G60: 91 | H60: =RC[-1]/fnld_total*100 -> 1.4902251058714868E-2 | I60: Modification notice | J60: 38,39,40
A61: F20_2014 | B61: F20 | D61: OTHER | E61: K | F61: Modification of a contract/concession during its term | G61: 24 | H61: =RC[-1]/fnld_total*100 -> 3.93026401548524E-3 | I61: Modification notice | J61: 38,39,40
A62: F21_2014 | B62: F21 | C62: AWARD_CONTRACT | D62: 32014L0024 | E62: 7 | F62: Contract award notice | G62: 4475 | H62: =RC[-1]/fnld_total*100 -> 0.73283047788735212 | I62: Social and other specific services – public contracts | J62: 4,12,20,33 | K62: 33 | L62: Contract award notice – general directive, light regime
A63: F21_2014 | B63: F21 | C63: CONTRACT | D63: 32014L0024 | E63: 3 | F63: Contract notice | G63: 4929 | H63: =RC[-1]/fnld_total*100 -> 0.80717797218028109 | I63: Social and other specific services – public contracts | J63: 4,12,20,33 | K63: 20 | L63: Contract notice – general directive, light regime
A64: F21_2014 | B64: F21 | C64: PRI_CALL_COMPETITION | D64: 32014L0024 | E64: A | F64: Prior information notice with call for competition | G64: 76 | H64: =RC[-1]/fnld_total*100 -> 1.2445836049036594E-2 | I64: Social and other specific services – public contracts | J64: 4,12,20,33 | K64: 12 | L64: Prior information notice used as a call for competition - general directive, light regime
A65: F21_2014 | B65: F21 | C65: PRI_ONLY | D65: 32014L0024 | E65: 0 | F65: Prior information notice without call for competition | G65: 207 | H65: =RC[-1]/fnld_total*100 -> 3.3898527133560195E-2 | I65: Social and other specific services – public contracts | J65: 4,12,20,33 | K65: 4 | L65: Prior information notice used only for information – general directive
A66: F22_2014 | B66: F22 | C66: AWARD_CONTRACT | D66: 32014L0025 | E66: 7 | F66: Contract award notice | G66: 115 | H66: =RC[-1]/fnld_total*100 -> 1.8832515074200109E-2 | I66: Social and other specific services – utilities | J66: 5,13,21,34 | K66: 34 | L66: Contract award notice – sectoral directive, light regime
A67: F22_2014 | B67: F22 | C67: CONTRACT | D67: 32014L0025 | E67: 3 | F67: Contract notice | G67: 98 | H67: =RC[-1]/fnld_total*100 -> 1.6048578063231397E-2 | I67: Social and other specific services – utilities | J67: 5,13,21,34 | K67: 21 | L67: Contract notice – sectoral directive, light regime
A68: F22_2014 | B68: F22 | C68: PER_CALL_COMPETITION | D68: 32014L0025 | E68: M | F68: Periodic indicative notice with call for competition | G68: 1 | H68: =RC[-1]/fnld_total*100 -> 1.6376100064521834E-4 | I68: Social and other specific services – utilities | J68: 5,13,21,34 | K68: 13 | L68: Periodic indicative notice used as a call for competition - sectoral directive, light regime
A69: F22_2014 | B69: F22 | C69: PER_ONLY | D69: 32014L0025 | E69: P | F69: Periodic indicative notice without call for competition | G69: 9 | H69: =RC[-1]/fnld_total*100 -> 1.4738490058069651E-3 | I69: Social and other specific services – utilities | J69: 5,13,21,34 | K69: 5 | L69: Periodic indicative notice used only for information – sectoral directive
A70: F22_2014 | B70: F22 | C70: QSU_ONLY | D70: 32014L0025 | E70: Q | F70: Qualification system without call for competition | G70: 1 | H70: =RC[-1]/fnld_total*100 -> 1.6376100064521834E-4 | I70: Social and other specific services – utilities | J70: 5,13,21,34
A71: F23_2014 | B71: F23 | C71: CONCESSION_AWARD_CONTRACT | D71: 32014L0023 | E71: J | F71: Concession award notice | G71: 34 | H71: =RC[-1]/fnld_total*100 -> 5.5678740219374237E-3 | I71: Social and other specific services – concessions | J71: 35 | K71: 35 | L71: Concession award notice – concessions directive, light regime
A72: F23_2014 | B72: F23 | C72: PRI | D72: 32014L0023 | E72: H | F72: Services concession | G72: 103 | H72: =RC[-1]/fnld_total*100 -> 1.6867383066457488E-2 | I72: Social and other specific services – concessions | J72: 35
A73: F24_2014 | B73: F24 | D73: 32014L0023 | E73: C | F73: Works concession | G73: 93 | H73: =RC[-1]/fnld_total*100 -> 1.5229773060005305E-2 | I73: Concession notice | J73: 19 | K73: 19 | L73: Concession notice – concessions directive, standard regime
A74: F24_2014 | B74: F24 | D74: 32014L0023 | E74: H | F74: Services concession | G74: 1135 | H74: =RC[-1]/fnld_total*100 -> 0.18586873573232282 | I74: Concession notice | J74: 19 | K74: 19 | L74: Concession notice – concessions directive, standard regime
A75: F25_2014 | B75: F25 | D75: 32014L0023 | E75: J | F75: Concession award notice | G75: 835 | H75: =RC[-1]/fnld_total*100 -> 0.13674043553875731 | I75: Concession award notice | J75: 32 | K75: 32 | L75: Concession award notice – concession directive, standard regime
A76: MOVE | B76: T01 | D76: 32007R1370 | E76: 0 | F76: Prior information notice without call for competition | G76: 582 | H76: =RC[-1]/fnld_total*100 -> 9.5308902375517077E-2 | I76: Prior information notice for public service contract | K76: T01
A77: MOVE | B77: T02 | D77: 32007R1370 | E77: 7 | F77: Contract award notice | G77: 37 | H77: =RC[-1]/fnld_total*100 -> 6.0591570238730788E-3 | I77: Information notice for award of public service contract | K77: T02
A78: EEIG | E78: G | F78: European economic interest grouping (EEIG) | G78: 33 | H78: =RC[-1]/fnld_total*100 -> 5.4041130212922053E-3
A79: OTH_NOT | D79: 32009L0081 | E79: 0 | F79: Prior information notice without call for competition | G79: 114 | H79: =RC[-1]/fnld_total*100 -> 1.8668754073554891E-2
A80: OTH_NOT | D80: 32009L0081 | E80: 1 | F80: Corrigendum | G80: 9 | H80: =RC[-1]/fnld_total*100 -> 1.4738490058069651E-3
A81: OTH_NOT | D81: 32009L0081 | E81: 2 | F81: Additional information | G81: 715 | H81: =RC[-1]/fnld_total*100 -> 0.11708911546133112
A82: OTH_NOT | D82: 32009L0081 | E82: 3 | F82: Contract notice | G82: 243 | H82: =RC[-1]/fnld_total*100 -> 3.9793923156788057E-2
A83: OTH_NOT | D83: 32009L0081 | E83: 5 | F83: Request for proposals | G83: 1 | H83: =RC[-1]/fnld_total*100 -> 1.6376100064521834E-4
A84: OTH_NOT | D84: 32009L0081 | E84: 7 | F84: Contract award notice | G84: 128 | H84: =RC[-1]/fnld_total*100 -> 2.0961408082587948E-2
A85: OTH_NOT | D85: 32009L0081 | E85: I | F85: Call for expressions of interest | G85: 14 | H85: =RC[-1]/fnld_total*100 -> 2.2926540090330567E-3
A86: OTH_NOT | D86: 32009L0081 | E86: P | F86: Periodic indicative notice without call for competition | G86: 1 | H86: =RC[-1]/fnld_total*100 -> 1.6376100064521834E-4
A87: OTH_NOT | D87: 32009L0081 | E87: S | F87: European company | G87: 124 | H87: =RC[-1]/fnld_total*100 -> 2.0306364080007074E-2
G88: =SUM(R[-86]C:R[-1]C) -> 610646